order,title,intro,title1,text1,image1,title2,text2,image1,title3,text3,image1,Conclusion,a,a,a,a,a,a,a,a,a,Tags
1,Unveiling the Magic of Makgeolli: Korea's Hidden Gem,"South Korea offers a rich culinary scene, and among its traditional drinks, makgeolli stands out. This fermented rice wine has a unique taste and deep cultural roots. But what exactly makes it special? Let's explore its history, production, and why it's gaining global popularity.",What is Makgeolli?,"Makgeolli is a traditional Korean alcoholic drink made from rice, water, and nuruk, a fermentation starter. It has a creamy texture, slight fizziness, and a balance of sweetness and tanginess. With a low alcohol content, it’s an easy-to-drink beverage that pairs well with various dishes, making it a favorite among locals and visitors alike.",https://res.cloudinary.com/dhwup3tvm/image/upload/v1737666644/MakgeolliGuru/image_article_makgeolliGuru/article1_1.jpg,Makgeolli and history,"Dating back to the Three Kingdoms period, makgeolli was originally a farmhouse brew enjoyed by both peasants and aristocrats. Over time, it became a staple of Korean dining culture, often served at celebrations and gatherings. Its resurgence today reflects a renewed interest in Korea’s culinary heritage.",https://res.cloudinary.com/dhwup3tvm/image/upload/v1737666644/MakgeolliGuru/image_article_makgeolliGuru/article1_2.jpg,Makgeolli and conviviality,"Drinking makgeolli is more than just enjoying alcohol—it’s about social bonding. Typically served in a shared bowl, it encourages conversation and togetherness. Whether paired with Korean dishes or enjoyed on its own, makgeolli embodies the spirit of hospitality and warmth that defines Korean culture.",https://res.cloudinary.com/dhwup3tvm/image/upload/v1737666644/MakgeolliGuru/image_article_makgeolliGuru/article1_3.jpg,"Makgeolli is not just a drink—it’s a cultural experience. From its rich history to its role in social gatherings, it continues to be a cherished part of Korean life. Next time you’re looking for an authentic taste of Korea, pour yourself a glass and enjoy its timeless charm.",막걸리의 마법을 발견하다: 한국의 숨은 보석,"한국의 다양한 전통 음료 중에서도 막걸리는 독특한 맛과 깊은 문화적 뿌리를 가진 특별한 술입니다. 하지만 막걸리는 무엇이 그렇게 특별할까요? 막걸리의 역사, 제조 과정, 그리고 전 세계적으로 인기를 끄는 이유를 알아봅시다.",막걸리란?,"막걸리는 쌀, 물, 누룩을 발효시켜 만든 전통 한국 술입니다. 크리미한 질감과 약간의 탄산감, 그리고 단맛과 신맛의 균형을 이루고 있습니다. 알코올 도수가 낮아 누구나 쉽게 즐길 수 있으며, 다양한 음식과 잘 어울려 많은 사람들에게 사랑받고 있습니다.",막걸리의 역사,"막걸리는 삼국 시대부터 존재했던 전통 술로, 농부부터 귀족까지 모두가 즐겼던 음료입니다. 오랜 세월 동안 한국 식문화의 중요한 일부로 자리 잡았으며, 현재는 전통 음식에 대한 관심이 높아지면서 다시 인기를 얻고 있습니다.",막걸리와 어울림,"막걸리는 단순한 술이 아니라 사람들을 연결하는 매개체입니다. 전통적으로 한 그릇에 나누어 마시는 문화가 있어, 대화를 나누고 함께 어울리는 분위기를 만듭니다. 다양한 한국 음식과 함께 즐길 수 있어 더욱 매력적인 술입니다.","막걸리는 단순한 술이 아닌 한국 문화의 일부입니다. 역사적인 가치부터 사람들과의 교류까지, 한국인의 삶에서 중요한 역할을 해왔습니다. 다음에 한국의 전통을 경험하고 싶다면, 막걸리 한 잔을 마시며 그 매력을 느껴보세요!",process history
2,Makgeolli Magic: The Perfect Pairings of Korean Rice Wine and Food,Pairing makgeolli with food enhances the dining experience. Its delicate flavors and slight effervescence make it a versatile match for Korean cuisine. But what are the best combinations? Let’s explore how makgeolli elevates different dishes.,The Versatile Charm of Makgeolli,"Makgeolli’s mild sweetness and acidity complement a variety of dishes. It pairs well with crispy fried chicken, savory seafood pancakes, and spicy stews. Its refreshing quality balances bold flavors, making it a go-to drink for any meal.",https://res.cloudinary.com/dhwup3tvm/image/upload/v1737666644/MakgeolliGuru/image_article_makgeolliGuru/article2_1.jpg,Mastering the Art of Pairing,"The key to a great pairing is balancing flavors and textures. Makgeolli enhances the light crispiness of jeon (Korean pancakes) and contrasts the rich umami of doenjang jjigae (soybean stew). Its subtle tartness cleanses the palate, making every bite more enjoyable.",https://res.cloudinary.com/dhwup3tvm/image/upload/v1737666644/MakgeolliGuru/image_article_makgeolliGuru/article2_2.jpg,Beyond Tradition: Exploring Creative Pairings,"Makgeolli isn't limited to Korean cuisine. It pairs surprisingly well with spicy Mexican dishes like tacos, as its acidity softens the heat. For dessert, try it with chocolate cake or fruit tarts—the mild sweetness complements rich flavors beautifully.",https://res.cloudinary.com/dhwup3tvm/image/upload/v1737666644/MakgeolliGuru/image_article_makgeolliGuru/article2_3.jpg,"Makgeolli’s versatility makes it a must-try for food lovers. Whether paired with traditional Korean dishes or global flavors, it brings a new dimension to dining. Experiment with pairings and discover your favorite combination!",막걸리 마법: 최고의 음식 페어링,막걸리는 음식과 함께 마실 때 더욱 맛이 살아납니다. 은은한 단맛과 약한 탄산감 덕분에 다양한 한식과 잘 어울리는데요. 어떤 음식과 가장 잘 어울릴까요? 막걸리가 음식의 맛을 어떻게 높여주는지 알아보겠습니다.,막걸리의 다채로운 매력,"막걸리는 단맛과 산미가 적절히 어우러져 있어, 바삭한 치킨, 해물파전, 매콤한 찌개와 잘 어울립니다. 산뜻한 맛이 강한 음식의 풍미를 조화롭게 만들어주어, 어떤 식사와도 잘 어울리는 술입니다.",음식과 완벽한 조화를 이루는 법,"훌륭한 페어링의 핵심은 맛과 식감의 균형을 맞추는 것입니다. 막걸리는 전의 바삭함을 더욱 강조해주고, 된장찌개의 깊은 감칠맛과도 조화를 이룹니다. 또한, 은은한 신맛이 입안을 깔끔하게 정리해주어 다음 한 입을 더욱 맛있게 만듭니다.",전통을 넘어 창의적인 페어링,"막걸리는 한식에만 국한되지 않습니다. 매운 멕시코 요리인 타코와도 잘 어울리며, 강한 매운맛을 부드럽게 완화해 줍니다. 디저트로는 초콜릿 케이크나 과일 타르트와 함께 즐겨보세요. 막걸리의 은은한 단맛이 진한 디저트와 훌륭한 조화를 이룹니다.","막걸리는 그 자체로도 훌륭하지만, 음식을 더 맛있게 해주는 역할을 합니다. 전통 한식은 물론 다양한 세계 음식과도 잘 어울리는 막걸리! 직접 다양한 조합을 시도해보며 나만의 최고의 페어링을 찾아보세요!",eating
3,Makgeolli and Jeon: A Perfect Pairing for Rainy Days in Korea,There’s nothing more comforting on a rainy day in Korea than makgeolli and jeon. This classic combination is a go-to for many Koreans when the weather turns gloomy. Let’s explore why this pairing is so beloved.,The Comforting Tradition of Makgeolli and Jeon,"Makgeolli, with its mild sweetness and creamy texture, is the perfect match for jeon—crispy, savory pancakes filled with vegetables, seafood, or meat. This pairing is a nostalgic comfort food, bringing warmth and satisfaction on cold, rainy days.",https://res.cloudinary.com/dhwup3tvm/image/upload/v1737666644/MakgeolliGuru/image_article_makgeolliGuru/article2_2.jpg,Embracing the Flavors of Rainy Days,"The crispy golden crust of jeon contrasts beautifully with the smooth effervescence of makgeolli. Each bite bursts with flavors like earthy mushrooms or tender seafood, while a sip of makgeolli refreshes the palate, making you crave another bite.",https://res.cloudinary.com/dhwup3tvm/image/upload/v1737666644/MakgeolliGuru/image_article_makgeolliGuru/article2_1.jpg,A Cultural Ritual in the Making,"More than just food, this pairing is a cultural ritual. Families and friends gather around, sharing stories and laughter over makgeolli and jeon. Whether at home or in a cozy restaurant, it’s a simple yet meaningful way to enjoy Korea’s food culture.",https://res.cloudinary.com/dhwup3tvm/image/upload/v1737666644/MakgeolliGuru/image_article_makgeolliGuru/article1_3.jpg,"Next time it rains, embrace the tradition of makgeolli and jeon. This comforting combination transforms a gloomy day into a warm, flavorful experience, reminding us of the simple joys of good food and good company.",막걸리와 전: 한국의 비 오는 날 최고의 조합,"비 오는 날 한국인들이 가장 즐겨 먹는 음식 조합이 있습니다. 바로 막걸리와 전입니다. 비 내리는 날, 왜 막걸리와 전이 완벽한 궁합을 이루는지 알아볼까요?","막걸리와 전, 따뜻한 위로의 조합","막걸리는 부드러운 단맛과 크리미한 질감이 특징이며, 전은 바삭하고 짭짤한 맛이 매력적입니다. 이 두 가지가 만나면, 한 입 한 모금마다 완벽한 조화를 이루며, 비 오는 날의 분위기를 더욱 살려줍니다.",비 오는 날의 특별한 맛,"노릇노릇하게 구워진 전의 바삭한 식감과 해산물 또는 채소의 풍미가 한 입 가득 퍼집니다. 여기에 막걸리 한 모금을 마시면, 신선한 단맛이 입안을 정리해 주며 다음 한 입이 더욱 기대되게 만듭니다.",한국 문화 속 따뜻한 의식,"단순한 음식 조합이 아니라, 막걸리와 전을 함께 먹는 것은 하나의 문화입니다. 가족, 친구들과 함께 모여 도란도란 이야기하며 즐기는 시간은 한국적인 정을 느낄 수 있는 순간입니다.","비 오는 날, 막걸리와 전을 즐기며 한국의 전통을 경험해 보세요. 단순한 음식이 아닌, 따뜻한 위로와 함께하는 특별한 순간을 선사할 것입니다.",eating
4,Sool Company: Your Gateway to Discovering Authentic Makgeolli and More,"Sool Company is a must-visit for anyone interested in Korean beverages. Located in Seoul, it offers a curated selection of makgeolli, craft brews, and traditional spirits. Let’s dive into what makes this place special.",A Haven for Makgeolli Enthusiasts,"Sool Company showcases artisanal makgeolli from small-batch producers across Korea. From classic brews to modern fruit-infused variations, each bottle highlights the craftsmanship and diversity of Korea’s rice wine culture.",https://res.cloudinary.com/dhwup3tvm/image/upload/v1737666644/MakgeolliGuru/image_article_makgeolliGuru/article4_1.jpg,Beyond Makgeolli: Exploring Korea's Drinking Culture,"The selection extends beyond makgeolli, featuring craft soju, aged cheongju, and herbal liqueurs. Visitors can explore a wide range of Korean traditional drinks, expanding their palate with unique flavors.",https://res.cloudinary.com/dhwup3tvm/image/upload/v1737666644/MakgeolliGuru/image_article_makgeolliGuru/article4_2.jpg,A Hub for Education and Exploration,"Sool Company also offers workshops and tastings led by experts. These experiences provide insight into the history and production of Korean alcoholic beverages, making it a great place for both beginners and connoisseurs.",https://res.cloudinary.com/dhwup3tvm/image/upload/v1737666644/MakgeolliGuru/image_article_makgeolliGuru/article4_3.jpg,"With its dedication to quality and education, Sool Company is the perfect place to discover Korea’s vibrant drinking culture. Whether you’re a makgeolli fan or curious about Korean beverages, this spot offers a journey of taste and tradition.",술 컴퍼니: 한국 전통주를 경험할 수 있는 곳,술 컴퍼니는 한국 전통주를 사랑하는 사람들에게 꼭 추천하고 싶은 곳입니다. 서울에 위치한 이곳에서는 막걸리뿐만 아니라 다양한 전통주와 수제 술을 만날 수 있습니다. 어떤 매력이 있는지 살펴볼까요?,막걸리 애호가를 위한 천국,"술 컴퍼니에서는 전국의 작은 양조장에서 만든 다양한 막걸리를 소개합니다. 클래식한 막걸리부터 과일 맛이 가미된 현대적인 막걸리까지, 한국 전통주의 다양성을 경험할 수 있습니다.","막걸리를 넘어, 한국의 술 문화 탐험","이곳에서는 막걸리뿐만 아니라 전통 소주, 숙성 청주, 한약재가 들어간 리큐르 등도 즐길 수 있습니다. 다양한 한국 전통주를 맛보며 새로운 미각의 세계를 탐험해 보세요.",교육과 체험의 장,술 컴퍼니에서는 전통주 전문가들이 진행하는 시음 및 교육 프로그램도 운영합니다. 한국 전통주의 역사와 제조 과정을 배우면서 더욱 깊이 있는 경험을 할 수 있습니다.,한국 전통주의 품질과 교육을 중요하게 생각하는 술 컴퍼니는 한국 술 문화를 배우고 싶은 사람들에게 최고의 장소입니다. 막걸리를 좋아하는 분들이나 새로운 경험을 원하시는 분들은 꼭 방문해 보세요!,location
5,Jinan Makgeolli Festival: Celebrating Korea's Beloved Rice Wine in Style,"The Jinan Makgeolli Festival is a highlight for makgeolli lovers. Held annually in Jinan, South Korea, it’s a vibrant event celebrating tradition, flavors, and community. Let’s explore what makes this festival special.",A Feast for the Senses,"The festival is a sensory delight, with the aroma of fermenting rice filling the air and stalls showcasing diverse makgeolli varieties. Visitors can taste, learn, and experience the rich heritage of Korea’s beloved rice wine.",https://res.cloudinary.com/dhwup3tvm/image/upload/v1737674018/MakgeolliGuru/image_article_makgeolliGuru/article4_3.png,A Showcase of Tradition and Innovation,"From classic brews to modern fruit-infused versions, the festival highlights both tradition and creativity. Brewers share their expertise, offering insights into makgeolli’s evolution and craftsmanship.",https://res.cloudinary.com/dhwup3tvm/image/upload/v1737666644/MakgeolliGuru/image_article_makgeolliGuru/article5_2.jpg,A Celebration of Community and Camaraderie,"Beyond tasting, the festival is about connection. Locals and visitors come together for performances, cultural activities, and lively gatherings, making it a true celebration of Korean hospitality.",https://res.cloudinary.com/dhwup3tvm/image/upload/v1737666644/MakgeolliGuru/image_article_makgeolliGuru/article4_1.jpg,"The Jinan Makgeolli Festival is an unforgettable experience. Whether you're a makgeolli enthusiast or a newcomer, it’s a perfect opportunity to immerse yourself in Korea’s rich drinking culture. Mark your calendar and raise a glass to this unique event!",진안 막걸리 축제: 한국 전통 막걸리를 즐기는 특별한 축제,"진안 막걸리 축제는 막걸리를 사랑하는 사람들에게 놓칠 수 없는 행사입니다. 매년 진안에서 열리는 이 축제는 전통과 맛, 그리고 사람들의 따뜻한 교류를 기념하는 자리입니다.",오감을 만족시키는 축제,"발효된 쌀의 향이 가득한 축제 현장에서는 다양한 막걸리를 맛볼 수 있습니다. 또한, 막걸리 제조 과정도 배울 수 있어 한국 전통주의 매력을 깊이 이해할 수 있습니다.",전통과 현대의 조화,"클래식한 막걸리부터 현대적인 과일 맛 막걸리까지, 다양한 스타일을 경험할 수 있습니다. 장인들의 손끝에서 탄생한 특별한 막걸리를 맛보며, 한국 술 문화의 변화를 느껴보세요.",문화 체험과 즐길 거리,"이 축제는 단순히 막걸리를 마시는 것뿐만 아니라 다양한 문화 체험도 제공합니다. 방문객들은 전통 막걸리 빚기 체험, 막걸리와 어울리는 한식 요리 시식, 그리고 신나는 전통 공연을 즐길 수 있습니다. 진안의 아름다운 자연 속에서 열리는 이 축제는 맛뿐만 아니라 멋진 분위기까지 선사합니다.",진안 막걸리 축제는 한국 전통 막걸리를 제대로 경험할 수 있는 최고의 기회입니다. 막걸리에 관심이 있다면 꼭 방문해 보세요!,event
6,Unveiling the Magic of Nuruk: The Heart of Makgeolli Brewing,"Nuruk is the key ingredient in makgeolli, responsible for its fermentation and unique flavors. Let’s explore its role, how it’s made, and where to experience it in Korea.",The Essence of Nuruk,"Nuruk is a fermentation starter made from grains like rice or wheat. It undergoes natural fermentation, developing yeasts and bacteria that break down starches into sugars, essential for alcohol production.",https://res.cloudinary.com/dhwup3tvm/image/upload/v1737666644/MakgeolliGuru/image_article_makgeolliGuru/article6_1.jpg,The Importance of Nuruk in Makgeolli Brewing,"Nuruk drives the fermentation process, creating the complex flavors of makgeolli. It not only produces alcohol but also contributes to the beverage’s signature taste and aroma.",https://res.cloudinary.com/dhwup3tvm/image/upload/v1737674018/MakgeolliGuru/image_article_makgeolliGuru/article4_3.png,Making Your Own Nuruk and Where to Experience It in Korea,"Nuruk can be made at home by fermenting and drying grains. For an authentic experience, visit traditional makgeolli breweries in Korea, where you can see the process firsthand and taste freshly brewed makgeolli.",https://res.cloudinary.com/dhwup3tvm/image/upload/v1737666644/MakgeolliGuru/image_article_makgeolliGuru/article1_1.jpg,"Nuruk is the heart of makgeolli brewing. Whether making it yourself or exploring it in Korea, understanding nuruk deepens appreciation for this traditional drink.",누룩의 마법을 밝혀내다: 막걸리 양조의 핵심,막걸리의 부드럽고 깊은 풍미는 단순한 쌀 발효만으로 이루어지지 않습니다. 그 중심에는 ‘누룩’이라는 특별한 발효제가 있습니다. 누룩이 막걸리 양조에서 어떤 역할을 하는지 살펴보겠습니다.,누룩이란?,"누룩은 밀, 쌀, 보리 등의 곡물을 발효시켜 만든 전통적인 한국 발효제입니다. 자연 속 미생물들이 곡물과 만나면서 발효가 이루어지며, 이 과정에서 막걸리 특유의 감칠맛과 향이 형성됩니다.",막걸리의 풍미를 결정하는 핵심 요소,"누룩은 단순한 발효제가 아니라, 막걸리의 맛과 향을 좌우하는 중요한 요소입니다. 사용된 곡물의 종류, 숙성 환경, 그리고 발효 과정에 따라 막걸리의 개성이 달라집니다. 누룩이 많을수록 깊고 복합적인 맛이 형성되며, 숙성 시간이 길어질수록 풍미가 더욱 진해집니다.",전통을 잇는 현대적 해석,"전통 방식으로 만든 누룩은 여전히 많은 양조장에서 사용되지만, 현대 기술을 접목하여 다양한 실험도 이루어지고 있습니다. 일부 양조장에서는 특정 미생물을 활용해 더욱 정교한 맛을 내는 시도를 하고 있으며, 전통과 현대의 조화 속에서 새로운 막걸리가 탄생하고 있습니다.","누룩은 막걸리 양조에서 없어서는 안 될 핵심 요소입니다. 누룩의 마법을 이해하면 막걸리의 깊은 세계를 더욱 잘 즐길 수 있습니다. 다음에 막걸리를 마실 때, 그 속에 담긴 누룩의 이야기를 떠올려 보세요!",process history